{
	"enabled": true,
	"sessionsDir": null,
	"indexOnStart": true,
	"includeToolResults": true,
	"maxResults": 10,
	"snippetsPerSession": 3,
	"excludeCurrentSession": true,
	"branchAliases": {
		"019ed061-2bf6-764a-aeef-719178fc8513": "current-work"
	},
	"contextGuard": {
		"enabled": true,
		"charsPerToken": 4,
		"maxContextFraction": 0.5,
		"maxResultChars": 60000,
		"minResultChars": 4000
	}
}
